{
 "v": 2,
 "market": "at",
 "currency": "EUR",
 "updated": "2026-10-11",
 "perKg": {
  "banan": {
   "lidl": 1.1
  },
  "boruvky": {
   "lidl": 11.1
  },
  "burrata": {
   "lidl": 14.7
  },
  "creme_fraiche": {
   "lidl": 6.2
  },
  "cuketa": {
   "lidl": 1.4
  },
  "fiky_cerstve": {
   "lidl": 4.8
  },
  "granatove_jablko": {
   "lidl": 4.0
  },
  "guanciale": {
   "lidl": 13.3
  },
  "halloumi": {
   "lidl": 10.2
  },
  "kachni_stehna": {
   "lidl": 16.0
  },
  "kalamary": {
   "lidl": 12.7
  },
  "krem_balsamico": {
   "lidl": 4.3
  },
  "kyprici_prasek": {
   "lidl": 8.1
  },
  "losos_uzeny": {
   "lidl": 21.3
  },
  "lunchmeat": {
   "lidl": 7.0
  },
  "mandarinka": {
   "lidl": 2.6
  },
  "margarin": {
   "lidl": 4.5
  },
  "marshmallow": {
   "lidl": 8.3
  },
  "mineralka": {
   "lidl": 0.3
  },
  "mozzarella": {
   "lidl": 7.9
  },
  "mrkev": {
   "lidl": 1.0
  },
  "paprika_spicata": {
   "lidl": 6.0
  },
  "pistacie": {
   "lidl": 9.9
  },
  "rybi_prsty": {
   "lidl": 8.2
  },
  "salam_pikantni": {
   "lidl": 9.3
  },
  "svestky": {
   "lidl": 2.0
  },
  "vejce": {
   "lidl": 7.2
  }
 },
 "deals": [
  {
   "ingredientId": "arasidove_maslo",
   "store": "lidl",
   "perKg": 5.2,
   "validFrom": "2026-10-15",
   "validTo": "2026-10-17",
   "title": "MCENNEDY Erdnussbutter"
  },
  {
   "ingredientId": "bagel",
   "store": "lidl",
   "perKg": 6.6,
   "validFrom": "2026-10-15",
   "validTo": "2026-10-17",
   "title": "MCENNEDY Bagels"
  },
  {
   "ingredientId": "datle",
   "store": "lidl",
   "perKg": 6.0,
   "validFrom": "2026-10-15",
   "validTo": "2026-10-17",
   "title": "ALESTO Bio Datteln"
  },
  {
   "ingredientId": "debrecinka",
   "store": "lidl",
   "perKg": 7.0,
   "validFrom": "2026-10-15",
   "validTo": "2026-10-17",
   "title": "WIESENTALER Debreziner"
  },
  {
   "ingredientId": "dzus_pomerancovy",
   "store": "lidl",
   "perKg": 2.4,
   "validFrom": "2026-10-15",
   "validTo": "2026-10-17",
   "title": "MCENNEDY Frischer Orangensaft"
  },
  {
   "ingredientId": "emental",
   "store": "lidl",
   "perKg": 9.7,
   "validFrom": "2026-10-12",
   "validTo": "2026-10-14",
   "title": "ALPENGUT Emmentaler"
  },
  {
   "ingredientId": "kureci_nugety",
   "store": "lidl",
   "perKg": 6.0,
   "validFrom": "2026-10-12",
   "validTo": "2026-10-14",
   "title": "Chicken Nuggets"
  },
  {
   "ingredientId": "mineralka",
   "store": "lidl",
   "perKg": 0.2,
   "validFrom": "2026-10-19",
   "validTo": "2026-10-21",
   "title": "SASKIA Mineralwasser"
  },
  {
   "ingredientId": "mrkev",
   "store": "lidl",
   "perKg": 1.0,
   "validFrom": "2026-10-19",
   "validTo": "2026-10-21",
   "title": "Karotten aus Österreich"
  },
  {
   "ingredientId": "spenat_cerstvy",
   "store": "lidl",
   "perKg": 3.6,
   "validFrom": "2026-10-19",
   "validTo": "2026-10-21",
   "title": "Spinat"
  }
 ],
 "categoryFallbackPerKg": {
  "vegetable": 1.84,
  "fruit": 2.46,
  "herb": 16.4,
  "spice": 36.9,
  "meat": 9.84,
  "poultry": 7.38,
  "fish": 14.35,
  "seafood": 18.45,
  "dairy": 4.92,
  "egg": 3.69,
  "grain": 1.64,
  "pasta": 2.46,
  "bakery": 3.28,
  "legume": 2.87,
  "nut": 14.35,
  "oil": 3.69,
  "sweetener": 2.05,
  "condiment": 6.15,
  "alcohol": 10.25,
  "beverage": 1.23,
  "other": 4.1
 }
}
