{
 "v": 2,
 "market": "sk",
 "currency": "EUR",
 "updated": "2026-10-11",
 "perKg": {
  "avokado": {
   "lidl": 5.8
  },
  "banan": {
   "lidl": 1.1
  },
  "brokolice_mrazena": {
   "lidl": 2.6
  },
  "broskve": {
   "lidl": 1.7
  },
  "cesnek": {
   "lidl": 4.0
  },
  "citron": {
   "lidl": 2.2
  },
  "dyne_hokkaido": {
   "lidl": 1.0
  },
  "dzus_multivitamin": {
   "lidl": 1.1
  },
  "eidam": {
   "lidl": 5.2
  },
  "emental": {
   "lidl": 7.5
  },
  "fiky_cerstve": {
   "lidl": 5.8
  },
  "granatove_jablko": {
   "lidl": 3.2
  },
  "hruska": {
   "lidl": 1.5
  },
  "jogurt_bily": {
   "lidl": 2.7
  },
  "kachna_cela": {
   "lidl": 3.0
  },
  "kachni_jatra": {
   "lidl": 34.9
  },
  "kachni_prsa": {
   "lidl": 7.9
  },
  "kachni_stehna": {
   "lidl": 7.9
  },
  "kastany": {
   "lidl": 6.5
  },
  "kedlubna": {
   "lidl": 1.6
  },
  "kureci_stehna": {
   "lidl": 4.5
  },
  "losos": {
   "lidl": 20.0
  },
  "majoneza": {
   "lidl": 4.8
  },
  "mlete_hovezi": {
   "lidl": 6.9
  },
  "mlete_kruti": {
   "lidl": 7.0
  },
  "mlete_maso_mix": {
   "lidl": 6.0
  },
  "mlete_veprove": {
   "lidl": 3.3
  },
  "mrkev": {
   "lidl": 0.6
  },
  "okurka_salatova": {
   "lidl": 1.6
  },
  "paprika_cervena": {
   "lidl": 2.0
  },
  "porek": {
   "lidl": 2.5
  },
  "rajcata_cherry": {
   "lidl": 6.0
  },
  "salat_ledovy": {
   "lidl": 2.0
  },
  "sunka": {
   "lidl": 5.6
  },
  "svestky": {
   "lidl": 1.2
  },
  "tatarska_omacka": {
   "lidl": 5.0
  },
  "treska_mrazena_file": {
   "lidl": 11.9
  },
  "veprova_krkovice": {
   "lidl": 4.0
  },
  "veprova_panenka": {
   "lidl": 5.5
  },
  "veprova_pecene": {
   "lidl": 3.9
  },
  "veprovy_bucek": {
   "lidl": 4.0
  }
 },
 "deals": [
  {
   "ingredientId": "banan",
   "store": "lidl",
   "perKg": 1.3,
   "validFrom": "2026-10-15",
   "validTo": "2026-10-18",
   "title": "Banány"
  },
  {
   "ingredientId": "brokolice_mrazena",
   "store": "lidl",
   "perKg": 2.4,
   "validFrom": "2026-10-15",
   "validTo": "2026-10-18",
   "title": "Brokolica"
  },
  {
   "ingredientId": "emental",
   "store": "lidl",
   "perKg": 7.5,
   "validFrom": "2026-10-08",
   "validTo": "2026-10-11",
   "title": "Ementál"
  },
  {
   "ingredientId": "kachni_stehna",
   "store": "lidl",
   "perKg": 7.5,
   "validFrom": "2026-10-12",
   "validTo": "2026-10-18",
   "title": "Kačacie stehná"
  },
  {
   "ingredientId": "kureci_stehna",
   "store": "lidl",
   "perKg": 4.5,
   "validFrom": "2026-10-08",
   "validTo": "2026-10-11",
   "title": "Kuracie stehná"
  },
  {
   "ingredientId": "mlete_maso_mix",
   "store": "lidl",
   "perKg": 6.0,
   "validFrom": "2026-10-15",
   "validTo": "2026-10-18",
   "title": "Mleté mäso MIX"
  },
  {
   "ingredientId": "mlete_veprove",
   "store": "lidl",
   "perKg": 3.3,
   "validFrom": "2026-10-05",
   "validTo": "2026-10-11",
   "title": "Mleté bravčové mäso"
  },
  {
   "ingredientId": "okurka_salatova",
   "store": "lidl",
   "perKg": 1.6,
   "validFrom": "2026-10-05",
   "validTo": "2026-10-11",
   "title": "Šalátové uhorky"
  },
  {
   "ingredientId": "svestky",
   "store": "lidl",
   "perKg": 1.3,
   "validFrom": "2026-10-12",
   "validTo": "2026-10-18",
   "title": "Slivky"
  },
  {
   "ingredientId": "veprova_krkovice",
   "store": "lidl",
   "perKg": 4.0,
   "validFrom": "2026-10-08",
   "validTo": "2026-10-11",
   "title": "Bravčová krkovička"
  }
 ],
 "categoryFallbackPerKg": {
  "vegetable": 1.84,
  "fruit": 2.46,
  "herb": 16.4,
  "spice": 36.9,
  "meat": 9.84,
  "poultry": 7.38,
  "fish": 14.35,
  "seafood": 18.45,
  "dairy": 4.92,
  "egg": 3.69,
  "grain": 1.64,
  "pasta": 2.46,
  "bakery": 3.28,
  "legume": 2.87,
  "nut": 14.35,
  "oil": 3.69,
  "sweetener": 2.05,
  "condiment": 6.15,
  "alcohol": 10.25,
  "beverage": 1.23,
  "other": 4.1
 }
}
