{
 "v": 2,
 "market": "pl",
 "currency": "PLN",
 "updated": "2026-10-17",
 "perKg": {
  "brokolice_mrazena": {
   "lidl": 12.0
  },
  "cesnek": {
   "lidl": 29.9
  },
  "citron": {
   "lidl": 8.0
  },
  "edamame": {
   "lidl": 39.9
  },
  "hruska": {
   "lidl": 4.0
  },
  "kaki": {
   "lidl": 23.5
  },
  "maliny": {
   "lidl": 47.9
  },
  "mochi_ryzove": {
   "lidl": 117.1
  },
  "okurky_nakladacky": {
   "lidl": 4.0
  },
  "ostruziny": {
   "lidl": 95.9
  },
  "pomeranc": {
   "lidl": 6.0
  },
  "porek": {
   "lidl": 22.4
  },
  "rukola": {
   "lidl": 47.9
  },
  "zampiony": {
   "lidl": 10.0
  },
  "zazvor": {
   "lidl": 16.9
  }
 },
 "deals": [
  {
   "ingredientId": "brokolice_mrazena",
   "store": "lidl",
   "perKg": 12.0,
   "validFrom": "2026-10-15",
   "validTo": "2026-10-17",
   "title": "Brokuły"
  },
  {
   "ingredientId": "rukola",
   "store": "lidl",
   "perKg": 47.9,
   "validFrom": "2026-10-15",
   "validTo": "2026-10-17",
   "title": "Rukola"
  }
 ],
 "categoryFallbackPerKg": {
  "vegetable": 7.65,
  "fruit": 10.2,
  "herb": 68.0,
  "spice": 153.0,
  "meat": 40.8,
  "poultry": 30.6,
  "fish": 59.5,
  "seafood": 76.5,
  "dairy": 20.4,
  "egg": 15.3,
  "grain": 6.8,
  "pasta": 10.2,
  "bakery": 13.6,
  "legume": 11.9,
  "nut": 59.5,
  "oil": 15.3,
  "sweetener": 8.5,
  "condiment": 25.5,
  "alcohol": 42.5,
  "beverage": 5.1,
  "other": 17.0
 }
}
