{
 "v": 2,
 "market": "de",
 "currency": "EUR",
 "updated": "2026-10-29",
 "perKg": {
  "arasidy": {
   "lidl": 3.6
  }
 },
 "deals": [],
 "categoryFallbackPerKg": {
  "vegetable": 1.84,
  "fruit": 2.46,
  "herb": 16.4,
  "spice": 36.9,
  "meat": 9.84,
  "poultry": 7.38,
  "fish": 14.35,
  "seafood": 18.45,
  "dairy": 4.92,
  "egg": 3.69,
  "grain": 1.64,
  "pasta": 2.46,
  "bakery": 3.28,
  "legume": 2.87,
  "nut": 14.35,
  "oil": 3.69,
  "sweetener": 2.05,
  "condiment": 6.15,
  "alcohol": 10.25,
  "beverage": 1.23,
  "other": 4.1
 }
}
